{"authority_owner":"Terrynce White","canonical_terms":{"ADMITTED_CONTINUATION":"a candidate history that extends the frozen history with owner-admitted accepted transitions.","CLOSEOUT_VERIFIER":"tooling that checks whether a candidate state is a valid admitted continuation of a frozen accepted starting state.","FROZEN_START":"the exact accepted state/history published before successor execution (08: c45b3c6)."},"claims":[{"basis":"successor implementation commit 37674170c4c0f50d5e0cc21065012ab0662b657c; frozen REAL-HANDOFF-09 acceptance 11/11 PASS; existing Handoff State suite 35/35 PASS at execution time plus current evaluator compatibility suite; independent verification 5 positive / 27 negative PASS; legitimate REAL-HANDOFF-08 frozen-start -> admitted-closeout fixture PASS; preserved original REAL-HANDOFF-08 freeze apparatus/evidence.","ceiling":"No claim beyond the tested Handoff State v0.1 fixture and adversarial cases; no general filesystem-security guarantee; no signatures; no CLI guarantee; no schema redesign; no autonomous retry; no claim that frozen-start identity and admitted-closeout validity are the same property.","claim":"The reusable v0.1 closeout verifier checks that a candidate history is an admitted append-only continuation of a frozen accepted state and enforces protected-file byte identity plus an explicit supplied allowlist for authorized implementation changes and added evidence."}],"current_state":"CLOSEOUT_VERIFIER_IMPLEMENTED_PENDING_OWNER_ADMISSION","failed_or_superseded_paths":[],"frozen_invariants":["pilot/09-closeout-verifier/SPEC.md and tests/test_closeout_verifier.py are frozen; implement to them, do not modify them.","Python 3 stdlib only; canonical v0.1 logic only (handoff/core.py, canonical.py, schema.py, render.py, store.py); no admission semantics in another language.","Do not modify pilot/08-intervals/verify_freeze.py, FREEZE.json, or frozen 08 evidence.","The 11 acceptance tests are the completion check; no other correctness criterion."],"goal":"Build a phase-aware closeout verifier for Handoff State v0.1 (handoff/closeout.py): verify that a candidate closeout is a valid admitted continuation of a frozen accepted starting state; all 11 acceptance tests passing.","identifiers":{"dates":{"spec_frozen":"2026-10-04"},"paths":{"task_dir":"pilot/09-closeout-verifier"},"receipts":{},"shas":{"closeout_py":"b61c0bb20cb42bb482f93107f1ca65a9e4ad196a444392796499b7cc91b396d6","closeout_py_completed":"672f46724b5ea8a4f2bc535f65f29d801997d88be8d065de62a4a9c1489f4e17","fixture_closeout":"bd58f07fdad7076783f3dffaa28ca1fa1b4060a0","fixture_frozen":"c45b3c611ecb496d6facc62643f0d685fe039f2a","midtask_tests":"1d4608a72fe5700cca18dca86461dc004e5e0ab2eb8adc8127d37b17997b6b52","spec":"c5e5d4ff94a7b52791e0706c3f3f594487f439204452f15da87be4d3cc958b22","successor_implementation_commit":"37674170c4c0f50d5e0cc21065012ab0662b657c","successor_starting_commit":"30349b77a154c44a0d8b076b45bff49f826cd5bc","tests":"5dd33491d11fe149d0eadc287e34186afb0ac21eaeff9d8a8fabfd169f828f04"},"versions":{"python":"3","schema":"openline.handoff-state.v0.1"}},"next_permitted_actions":["Terrynce White may review the implementation commit, frozen test results, independent cases, preservation evidence and this exact unadmitted completion delta; only Terrynce White may explicitly admit it.","Keep accepted REAL-HANDOFF-09 state/history/rendering unchanged until explicit owner admission; this proposal does not authorize admission, merge, REAL-HANDOFF-10, Stage 3, signatures, schema redesign or autonomous retry.","Stop after reporting implementation and the proposed completion delta; preserve all protected REAL-HANDOFF-08 artifacts, original 09 evidence and frozen acceptance tests."],"open_questions":[{"owner":"Terrynce White","question":"Should verify_closeout gain a CLI entry point (python -m handoff.closeout)? Out of scope unless the owner approves."}],"proposed_state_changes":[],"roles":{"admitter":"Terrynce White","author":"Muse","executor":"Muse","proposer":"Terrynce White","verifier":"Muse"},"schema":"openline.handoff-state.v0.1","stop_conditions":["Do not modify the frozen SPEC.md.","Do not modify pilot/08-intervals/verify_freeze.py, FREEZE.json, or frozen 08 evidence.","Do not weaken the 08 frozen-start guard to make the new verifier pass.","Do not self-admit completion; Terrynce White alone admits state transitions."],"task_id":"REAL-HANDOFF-09","verified_facts":[{"evidence":"pilot/09-closeout-verifier/SPEC.md sha256:c5e5d4ff94a7b52791e0706c3f3f594487f439204452f15da87be4d3cc958b22","fact":"SPEC.md frozen for the maintenance task."},{"evidence":"git rev-parse c45b3c6 / bd58f07; pilot/08-intervals trees at both commits","fact":"Reference fixture: REAL-HANDOFF-08 frozen start c45b3c6 (2 accepted records, A_PARTIAL) and legitimate admitted closeout bd58f07 (seq 3, A_COMPLETE_PENDING_OWNER_ADMISSION)."},{"evidence":"handoff/closeout.py sha256:b61c0bb20cb42bb482f93107f1ca65a9e4ad196a444392796499b7cc91b396d6","fact":"Partial implementation: handoff/closeout.py verify_closeout() implements checks 1-5 (history preserved/extended, first-new-record linkage and admission, full chain replay, final hash) and the rejection paths of check 8, using canonical v0.1 evaluate/verify_record/apply_delta."},{"evidence":"handoff/closeout.py sha256:b61c0bb20cb42bb482f93107f1ca65a9e4ad196a444392796499b7cc91b396d6; pilot/09-closeout-verifier/evidence/midtask-tests.txt sha256:1d4608a72fe5700cca18dca86461dc004e5e0ab2eb8adc8127d37b17997b6b52","fact":"Checks 6-7 (protected-file byte-identity and the explicit allowlist for legitimate closeout changes) are scaffolded in the signature but NOT yet enforced; file_checks reports 'not_implemented'."},{"evidence":"pilot/09-closeout-verifier/evidence/midtask-tests.txt sha256:1d4608a72fe5700cca18dca86461dc004e5e0ab2eb8adc8127d37b17997b6b52","fact":"9/11 acceptance tests pass; the 2 failures are test_unexpected_protected_file_change_fails and test_unlisted_new_file_fails — the verifier currently passes tampered-file variants it must reject."},{"evidence":"python -m unittest discover -s handoff/tests (2026-10-04)","fact":"Canonical Handoff State suite: 35/35 pass with the new module present."},{"evidence":"git status: only new files added under handoff/closeout.py and pilot/09-closeout-verifier/","fact":"08 freeze guard, FREEZE.json, and frozen 08 evidence untouched by this work."},{"evidence":"pilot/09-closeout-verifier/SPEC.md; pilot/08-intervals/evidence/execution/closeout-ci-record.md","fact":"This maintenance exists because exact frozen-start identity and valid admitted closeout continuation are different verification phases; the original REAL-HANDOFF-08 guard correctly rejects an admitted successor and remains unchanged."},{"evidence":"handoff/closeout.py sha256:672f46724b5ea8a4f2bc535f65f29d801997d88be8d065de62a4a9c1489f4e17; implementation commit 37674170c4c0f50d5e0cc21065012ab0662b657c","fact":"Reusable handoff/closeout.py now enforces protected-file byte identity and supplied explicit Allowlist permissions, including structural state/log/render agreement; no permissions are inferred from changed files."},{"evidence":"https://github.com/terryncew/openline-handoff-state/actions/runs/37176851491/job/111361145921","fact":"Frozen REAL-HANDOFF-09 acceptance passed 11/11; existing Handoff State suite passed 35/35 using canonical Python 3.12.14."},{"evidence":"pilot/09-closeout-verifier/evidence/execution/independent-verification.json; validation commit 51b3bebe673edc9c54c24322a8ee723ed5dc1785","fact":"Independent checks passed 5 positive and 27 negative cases, including legitimate frozen REAL-HANDOFF-08 start to admitted closeout, explicit implementation/evidence allowances, alternative task directory, protected changes/deletions, missing allowances, structural tampering and unaccepted/skipped appended records."},{"evidence":"pilot/09-closeout-verifier/evidence/execution/independent-verification.json; starting commit 30349b77a154c44a0d8b076b45bff49f826cd5bc","fact":"The entire existing REAL-HANDOFF-08 subtree is byte-identical to starting main; the original guard, FREEZE.json, protected historical evidence and 28 unchanged freeze-manifest digests are preserved. Original 09 evidence, frozen SPEC/tests and accepted 09 state/history/rendering are unchanged."},{"evidence":"pilot/09-closeout-verifier/proposals/completion/proposal.json; accepted REAL-HANDOFF-09 seq 1 remains unchanged","fact":"Implementation completion is reported for owner review; this proposal has empty admission and does not advance accepted Handoff State. No merge, owner admission, Stage 3 or REAL-HANDOFF-10 was performed."}]}
