{"authority_owner":"Terrynce White","canonical_terms":{"OPERATIONAL_DOGFOOD":"the REAL-HANDOFF-10 property: the pilot's own tooling is productized through a usable interface without weakening its semantics.","VERIFY_CLOSEOUT_CLI":"the 'verify-closeout' subcommand of python -m handoff: loads frozen/candidate inputs from local git refs and calls canonical verify_closeout()."},"claims":[{"basis":"implementation in handoff/__main__.py; frozen pilot/10-cli/SPEC.md; 11/11 tests in pilot/10-cli/tests/test_closeout_cli.py pass; real 08 fixture c45b3c6 -> bd58f07 verified exit 0 via the CLI; 48/48 suite and 11/11 09 library tests green","ceiling":"No claim about CI integration (not yet built); no claim beyond the tested fixture and cases; the CLI verifies only and never admits, appends, or modifies accepted state/history.","claim":"The verify-closeout CLI parses refs/task-dir/owner/allowlist, loads inputs from local git refs, and delegates to canonical verify_closeout(); the real 08 fixture verifies (exit 0) and representative unauthorized cases are rejected. 11/11 CLI acceptance tests pass."}],"current_state":"MID_TASK_CLOSEOUT_CLI","failed_or_superseded_paths":[{"classification":"superseded: fixed to parents[3]; 11/11 pass. Test-only defect.","evidence":"pilot/10-cli/tests/test_closeout_cli.py ROOT definition; test run 2026-10-04","path":"Test harness ROOT used Path.parents[2] (pilot/) instead of parents[3] (repo root); every subprocess CLI invocation failed with 'No module named handoff'."},{"classification":"superseded: import added; positive fixture verifies exit 0.","evidence":"manual CLI run 2026-10-04","path":"First __main__.py edit omitted 'import subprocess' (the applied edit replaced a failed one that had carried it); NameError on first manual CLI run."},{"classification":"superseded: chose the verify-closeout subcommand of the existing handoff/__main__.py CLI surface as the smallest clean structure.","evidence":"pilot/10-cli/SPEC.md interface section","path":"Considered 'python -m handoff.closeout' as the entry point."}],"frozen_invariants":["pilot/10-cli/SPEC.md and pilot/10-cli/tests/test_closeout_cli.py are frozen; implement to them, do not modify them to pass.","Python 3 stdlib only; the CLI calls canonical verify_closeout() (handoff/closeout.py); no admission, evaluation, replay, or rendering semantics are duplicated.","Do not modify handoff/closeout.py semantics, evaluator v0.1.1 semantics, historical transition records, the REAL-HANDOFF-08 freeze apparatus/evidence, or the REAL-HANDOFF-09 accepted history/evidence.","No schemas altered; no signatures; no autonomous retry; no Stage 3."],"goal":"Build a small reusable CLI around the canonical Python v0.1.1 closeout verifier (handoff/closeout.py verify_closeout()) so a maintainer or CI job can mechanically verify an admitted continuation; all frozen acceptance tests passing; no second verifier; no weakened semantics.","identifiers":{"dates":{"spec_frozen":"2026-10-04"},"paths":{"task_dir":"pilot/10-cli"},"receipts":{},"shas":{"cli_tests":"e65d253232ce1d2b3f13bb374a9d193f2019c7e5cf62d4f10e51ef34db0ad48f","evaluator_base":"b908865f65908ea224a45bb3c76ac0f50d3ef6d","fixture_closeout":"bd58f07fdad7076783f3dffaa28ca1fa1b4060a0","fixture_frozen":"c45b3c611ecb496d6facc62643f0d685fe039f2a","main_py":"65e0940998312b21401362ceab0d6b8f709798316000a6711ce369b08db0f7f6","spec_md":"33fe9b51a3b325fed44525db08e7d74096f8ead82d6d51012d3500c8fe20408c"},"versions":{"evaluator":"0.1.1","schema":"openline.handoff-state.v0.1"}},"next_permitted_actions":["Add the phase-appropriate CI smoke test or workflow demonstrating actual invocation of the CLI (SPEC requirement 11): e.g. .github/workflows/closeout-cli-smoke.yml running the real 08 fixture (frozen c45b3c6, closeout bd58f07, owner Terrynce White, the explicit allowlist) and asserting exit 0 plus JSON keys; stdlib + git only.","Actuate the new workflow (CI run) until green; do not weaken the CLI, the verifier, or the frozen tests to make it pass.","Re-run the full frozen acceptance battery (11/11 CLI tests, 48/48 Handoff State suite, 11/11 09 library tests, replay compatibility) and record the results as evidence.","Report completion for Terrynce White to admit; append the admitted seq-2 closeout only on his explicit admission order. Do not self-admit; do not start Stage 3."],"open_questions":[{"owner":"Terrynce White","question":"CI workflow shape for requirement 11 (new workflow file vs extending an existing one) — successor's call; keep it minimal and stdlib+git only."}],"proposed_state_changes":[{"change":"CLI implementation in handoff/__main__.py (verify-closeout subcommand)","evidence":"11/11 acceptance green 2026-10-04","status":"done"},{"change":"CI smoke test/workflow demonstrating actual CLI invocation (SPEC requirement 11)","evidence":"none yet; successor work","status":"remaining"}],"roles":{"admitter":"Terrynce White","author":"Muse","executor":"Muse","proposer":"Terrynce White","verifier":"Muse"},"schema":"openline.handoff-state.v0.1","stop_conditions":["Do not modify pilot/10-cli/SPEC.md or pilot/10-cli/tests/test_closeout_cli.py to make them pass.","Do not create a second verifier; the CLI must call verify_closeout().","Do not infer allowlist permissions from the diff.","Do not modify historical transition records, the 08 freeze apparatus/evidence, or the 09 accepted history/evidence.","Do not alter schemas; no signatures; no autonomous retry; no Stage 3.","Do not self-admit completion; Terrynce White alone admits state transitions."],"task_id":"real-handoff-10","verified_facts":[{"evidence":"handoff/__main__.py sha256:65e0940998312b21401362ceab0d6b8f709798316000a6711ce369b08db0f7f6","fact":"The verify-closeout CLI subcommand is implemented in handoff/__main__.py: parses --frozen-ref/--candidate-ref/--task-dir/--owner/--allow-implementation-changed/--allow-evidence-added, loads inputs from local git refs only, builds the explicit Allowlist unchanged, calls verify_closeout(), prints stable JSON, exits 0/1/2."},{"evidence":"manual CLI run 2026-10-04; pilot/10-cli/tests/test_closeout_cli.py::RealFixtureTest::test_legitimate_closeout_passes_exit_0","fact":"The real REAL-HANDOFF-08 fixture verifies through the CLI: frozen c45b3c611ecb496d6facc62643f0d685fe039f2a -> closeout bd58f07fdad7076783f3dffaa28ca1fa1b4060a0, owner Terrynce White, explicit allowlist: exit 0, passed true."},{"evidence":"pilot/10-cli/tests/test_closeout_cli.py, 11/11 pass","fact":"Allowlist mechanics proven through the CLI: omitting evidence_added fails on unlisted new files; omitting implementation_changed fails on protected bytes changed (intervals.py). Wrong owner, nonexistent ref, malformed allowlist, and missing required argument are all rejected with the specified exit codes."},{"evidence":"python -m unittest discover runs, 2026-10-04","fact":"Regression suites green: 48/48 Handoff State suite (includes 09 claim-evolution tests and repository-wide replay compatibility audit); 11/11 existing verify_closeout() library tests."},{"evidence":"handoff/__main__.py verify_closeout_command; handoff/closeout.py _verify_files","fact":"Permission is never inferred from the diff: the CLI passes the supplied allowlist verbatim to verify_closeout(); the library performs all checks."},{"evidence":"handoff/core.py EVALUATOR_VERSION; pilot/10-cli/SPEC.md","fact":"Evaluator is v0.1.1 (EVALUATOR_VERSION); the CLI wraps rather than duplicates verify_closeout() because admission/evaluation semantics must remain single-sourced in canonical Python."}]}
